{
  "$schema": "./activity_catalog_schema_v1.json",
  "catalog_version": "1.0.3",
  "policy_compatibility": "1.0.x",
  "vocabulary_version": "1.0.0",
  "status": "published",
  "activity_count": 23,
  "notes": [
    "activities_v1.json est la source de vérité du catalogue V0.",
    "Le Markdown lisible est généré automatiquement depuis ce fichier.",
    "internal_family est conservé comme métadonnée éditoriale; le moteur V0 ne l'utilise pas pour le scoring.",
    "Les niveaux de preuve sont documentaires et ne sont pas des multiplicateurs de score.",
    "Les activités publiées restent comprises entre 30 secondes et 5 minutes.",
    "Les recommandations de posture sont affichées par l’UX à partir des métadonnées; elles ne sont pas répétées dans les consignes.",
    "guidance_mode explicite le parcours V0 : timer pour les activités nécessitant un guidage temporel, simple sinon."
  ],
  "activities": [
    {
      "id": "MOUV01",
      "revision": 2,
      "status": "published",
      "title": "Une petite marche ?",
      "instruction": "Et si tu allais marcher 2 à 5 minutes pour te dégourdir les jambes ?",
      "user_category": "mouvement",
      "internal_family": "walking",
      "intensity": "active",
      "duration_seconds_min": 120,
      "duration_seconds_max": 300,
      "compatible_postures": [
        "standing"
      ],
      "preferred_posture": "standing",
      "standing_required": true,
      "walking_required": true,
      "eligible_opportunity_types": [
        "standard"
      ],
      "sedentary_break_effect": "certain",
      "space_required": "outside_desk",
      "discretion": "medium",
      "body_focus": [
        "legs",
        "whole_body"
      ],
      "safety_flags": [
        "stop_if_pain"
      ],
      "evidence_level": "high",
      "base_weight": 12,
      "variant_of": null,
      "search_synonyms": [
        "dégourdir les jambes",
        "marche",
        "marcher"
      ],
      "guidance_mode": "simple"
    },
    {
      "id": "MOUV02",
      "revision": 3,
      "status": "published",
      "title": "Un verre d’eau ?",
      "instruction": "Lève-toi, marche un peu et profite-en pour aller prendre un verre d’eau.",
      "user_category": "mouvement",
      "internal_family": "walking_hydration_anchor",
      "intensity": "gentle",
      "duration_seconds_min": 120,
      "duration_seconds_max": 300,
      "compatible_postures": [
        "standing"
      ],
      "preferred_posture": "standing",
      "standing_required": true,
      "walking_required": true,
      "eligible_opportunity_types": [
        "standard"
      ],
      "sedentary_break_effect": "certain",
      "space_required": "outside_desk",
      "discretion": "medium",
      "body_focus": [
        "legs",
        "whole_body"
      ],
      "safety_flags": [],
      "evidence_level": "indirect",
      "base_weight": 7,
      "variant_of": null,
      "search_synonyms": [
        "bouteille",
        "eau",
        "fontaine"
      ],
      "guidance_mode": "simple"
    },
    {
      "id": "MOUV03",
      "revision": 3,
      "status": "published",
      "title": "Un petit tour par les escaliers ?",
      "instruction": "Si tu as des escaliers à proximité, monte ou descends un étage tranquillement. Tu peux en profiter pour aller prendre l’air ou simplement faire un petit détour.",
      "user_category": "mouvement",
      "internal_family": "stairs",
      "intensity": "dynamic",
      "duration_seconds_min": 60,
      "duration_seconds_max": 180,
      "compatible_postures": [
        "standing"
      ],
      "preferred_posture": "standing",
      "standing_required": true,
      "walking_required": true,
      "eligible_opportunity_types": [
        "standard"
      ],
      "sedentary_break_effect": "certain",
      "space_required": "building",
      "discretion": "low",
      "body_focus": [
        "cardiorespiratory",
        "legs"
      ],
      "safety_flags": [
        "avoid_if_balance_issue",
        "stop_if_pain"
      ],
      "evidence_level": "moderate",
      "base_weight": 5,
      "variant_of": null,
      "search_synonyms": [
        "escaliers",
        "étage"
      ],
      "guidance_mode": "simple"
    },
    {
      "id": "MOUV04",
      "revision": 3,
      "status": "published",
      "title": "Prendre un peu l’air ?",
      "instruction": "Si tu peux sortir quelques minutes, va marcher tranquillement dehors.",
      "user_category": "mouvement",
      "internal_family": "outdoor_walk",
      "intensity": "gentle",
      "duration_seconds_min": 180,
      "duration_seconds_max": 300,
      "compatible_postures": [
        "standing"
      ],
      "preferred_posture": "standing",
      "standing_required": true,
      "walking_required": true,
      "eligible_opportunity_types": [
        "standard"
      ],
      "sedentary_break_effect": "certain",
      "space_required": "outside",
      "discretion": "low",
      "body_focus": [
        "legs",
        "whole_body"
      ],
      "safety_flags": [],
      "evidence_level": "indirect",
      "base_weight": 7,
      "variant_of": "MOUV01",
      "search_synonyms": [
        "air",
        "dehors",
        "extérieur"
      ],
      "guidance_mode": "simple"
    },
    {
      "id": "MOB01",
      "revision": 3,
      "status": "published",
      "title": "Quelques cercles d’épaules ?",
      "instruction": "Fais lentement quelques cercles avec les épaules, puis laisse-les redescendre.",
      "user_category": "mobilite",
      "internal_family": "shoulder_mobility",
      "intensity": "gentle",
      "duration_seconds_min": 30,
      "duration_seconds_max": 60,
      "compatible_postures": [
        "seated",
        "standing"
      ],
      "preferred_posture": null,
      "standing_required": false,
      "walking_required": false,
      "eligible_opportunity_types": [
        "standard"
      ],
      "sedentary_break_effect": "optional",
      "space_required": "desk",
      "discretion": "high",
      "body_focus": [
        "shoulders",
        "upper_back"
      ],
      "safety_flags": [
        "no_forced_range",
        "stop_if_pain"
      ],
      "evidence_level": "limited",
      "base_weight": 6,
      "variant_of": null,
      "search_synonyms": [
        "cercles épaules",
        "épaules"
      ],
      "guidance_mode": "simple"
    },
    {
      "id": "MOB02",
      "revision": 4,
      "status": "published",
      "title": "Tourne doucement le haut du corps",
      "instruction": "Tourne doucement le buste vers la droite, reviens au centre, puis vers la gauche. Répète sans forcer.",
      "user_category": "mobilite",
      "internal_family": "thoracic_rotation",
      "intensity": "gentle",
      "duration_seconds_min": 45,
      "duration_seconds_max": 90,
      "compatible_postures": [
        "seated",
        "standing"
      ],
      "preferred_posture": "standing",
      "standing_required": false,
      "walking_required": false,
      "eligible_opportunity_types": [
        "standard"
      ],
      "sedentary_break_effect": "probable",
      "space_required": "desk",
      "discretion": "medium",
      "body_focus": [
        "thoracic_spine",
        "trunk"
      ],
      "safety_flags": [
        "no_forced_range",
        "stop_if_pain"
      ],
      "evidence_level": "limited",
      "base_weight": 5,
      "variant_of": null,
      "search_synonyms": [
        "rotation dos",
        "torsion",
        "tourner le buste"
      ],
      "guidance_mode": "simple"
    },
    {
      "id": "MOB03",
      "revision": 4,
      "status": "published",
      "title": "Fais bouger tes chevilles",
      "instruction": "Fais quelques mouvements ou rotations avec chaque cheville, tranquillement.",
      "user_category": "mobilite",
      "internal_family": "ankle_mobility",
      "intensity": "gentle",
      "duration_seconds_min": 30,
      "duration_seconds_max": 60,
      "compatible_postures": [
        "seated",
        "standing"
      ],
      "preferred_posture": "standing",
      "standing_required": false,
      "walking_required": false,
      "eligible_opportunity_types": [
        "standard"
      ],
      "sedentary_break_effect": "probable",
      "space_required": "desk",
      "discretion": "high",
      "body_focus": [
        "ankles"
      ],
      "safety_flags": [
        "stop_if_pain",
        "use_support_if_needed"
      ],
      "evidence_level": "limited",
      "base_weight": 5,
      "variant_of": null,
      "search_synonyms": [
        "cercles chevilles",
        "chevilles"
      ],
      "guidance_mode": "simple"
    },
    {
      "id": "MOB04",
      "revision": 4,
      "status": "published",
      "title": "Mobilise doucement l’arrière des jambes",
      "instruction": "Penche doucement le buste vers l’avant, remonte, puis recommence quelques fois, sans chercher à tenir la position.",
      "user_category": "mobilite",
      "internal_family": "posterior_chain_mobility",
      "intensity": "gentle",
      "duration_seconds_min": 30,
      "duration_seconds_max": 60,
      "compatible_postures": [
        "seated",
        "standing"
      ],
      "preferred_posture": "standing",
      "standing_required": false,
      "walking_required": false,
      "eligible_opportunity_types": [
        "standard"
      ],
      "sedentary_break_effect": "probable",
      "space_required": "desk",
      "discretion": "medium",
      "body_focus": [
        "back",
        "hamstrings",
        "posterior_chain"
      ],
      "safety_flags": [
        "no_forced_range",
        "soft_knees_allowed",
        "stop_if_dizziness",
        "stop_if_pain"
      ],
      "evidence_level": "limited",
      "base_weight": 4,
      "variant_of": null,
      "search_synonyms": [
        "arrière jambes",
        "chaîne postérieure",
        "toucher le sol"
      ],
      "guidance_mode": "simple"
    },
    {
      "id": "MOB05",
      "revision": 4,